[
  {
    "segment_id": "NER-D-001",
    "date": "2026-09-08",
    "flood_probability": 0.065,
    "confidence": 0.65,
    "contributing_factors": {
      "rainfall_7day_mm": 57.8,
      "elevation_m": 52.0,
      "river_proximity_km": 0.4,
      "historical_flood_frequency": null,
      "scoring_method": "ml_calibrated",
      "model_version": "p1_flood_v2_river_enriched"
    },
    "source_timestamp": "2026-09-08T20:50:10.538189+05:30"
  },
  {
    "segment_id": "NER-D-002",
    "date": "2026-09-08",
    "flood_probability": 0.065,
    "confidence": 0.65,
    "contributing_factors": {
      "rainfall_7day_mm": 42.8,
      "elevation_m": 1436.0,
      "river_proximity_km": 0.74,
      "historical_flood_frequency": null,
      "scoring_method": "ml_calibrated",
      "model_version": "p1_flood_v2_river_enriched"
    },
    "source_timestamp": "2026-09-08T20:50:10.538189+05:30"
  },
  {
    "segment_id": "NER-D-003",
    "date": "2026-09-08",
    "flood_probability": 0.065,
    "confidence": 0.65,
    "contributing_factors": {
      "rainfall_7day_mm": 66.3,
      "elevation_m": 782.0,
      "river_proximity_km": 1.55,
      "historical_flood_frequency": null,
      "scoring_method": "ml_calibrated",
      "model_version": "p1_flood_v2_river_enriched"
    },
    "source_timestamp": "2026-09-08T20:50:10.538189+05:30"
  },
  {
    "segment_id": "NER-D-004",
    "date": "2026-09-08",
    "flood_probability": 0.065,
    "confidence": 0.65,
    "contributing_factors": {
      "rainfall_7day_mm": 81.6,
      "elevation_m": 12.0,
      "river_proximity_km": 0.71,
      "historical_flood_frequency": null,
      "scoring_method": "ml_calibrated",
      "model_version": "p1_flood_v2_river_enriched"
    },
    "source_timestamp": "2026-09-08T20:50:10.538189+05:30"
  },
  {
    "segment_id": "NER-D-005",
    "date": "2026-09-08",
    "flood_probability": 0.065,
    "confidence": 0.65,
    "contributing_factors": {
      "rainfall_7day_mm": 76.8,
      "elevation_m": 291.0,
      "river_proximity_km": 0.17,
      "historical_flood_frequency": null,
      "scoring_method": "ml_calibrated",
      "model_version": "p1_flood_v2_river_enriched"
    },
    "source_timestamp": "2026-09-08T20:50:10.538189+05:30"
  }
]